<?xml version="1.0" encoding="UTF-8"?>
<test xmlns:xsi="http://www.w3.org/2001/XMLSchema-instance" xsi:noNamespaceSchemaLocation="../../schemas/test.xsd">
	<question id="q1" label="test.q1">
		<answer id="a1" label="test.q1.a1" points="0"/>
		<answer id="a2" label="test.q1.a2" points="10"/>
		<answer id="a3" label="test.q1.a3" points="20"/>
	</question>
	<question id="q2" label="test.q2">
		<answer id="a1" label="test.q2.a1" points="20"/>
		<answer id="a2" label="test.q2.a2" points="10"/>
		<answer id="a3" label="test.q2.a3" points="0"/>
	</question>
	<question id="q3" label="test.q3">
		<answer id="a1" label="test.q3.a1" points="20"/>
		<answer id="a2" label="test.q3.a2" points="10"/>
		<answer id="a3" label="test.q3.a3" points="0"/>
	</question>
	<question id="q4" label="test.q4">
		<answer id="a1" label="test.q4.a1" points="0"/>
		<answer id="a2" label="test.q4.a2" points="10"/>
		<answer id="a3" label="test.q4.a3" points="20"/>
	</question>
	<question id="q5" label="test.q5">
		<answer id="a1" label="test.q5.a1" points="20"/>
		<answer id="a2" label="test.q5.a2" points="0"/>
		<answer id="a3" label="test.q5.a3" points="-100"/>
	</question>
	<question id="q6" label="test.q6">
		<answer id="a1" label="test.q6.a1" points="20"/>
		<answer id="a2" label="test.q6.a2" points="10"/>
		<answer id="a3" label="test.q6.a3" points="0"/>
	</question>
	<question id="q7" label="test.q7">
		<answer id="a1" label="test.q7.a1" points="20"/>
		<answer id="a2" label="test.q7.a2" points="10"/>
		<answer id="a3" label="test.q7.a3" points="0"/>
	</question>
	<question id="q8" label="test.q8">
		<answer id="a1" label="test.q8.a1" points="10"/>
		<answer id="a2" label="test.q8.a2" points="20"/>
		<answer id="a3" label="test.q8.a3" points="0"/>
	</question>
</test>
